{
  "sourceFile": "classic-iii-5620-kadusesite-cutout.png",
  "analysisMethod": "channels/kaduse-medikal/scripts/analyze_product_image.py (alpha-threshold=32, real PIL/numpy/scipy computation, not a manual estimate)",
  "canvas": {
    "width": 576,
    "height": 756
  },
  "alphaMask": {
    "opaquePx": 141849,
    "canvasPx": 435456,
    "pctOpaque": 32.6
  },
  "visiblePixelBounds": {
    "x": 57,
    "y": 3,
    "width": 490,
    "height": 747
  },
  "negativeSpaceMarginsPct": {
    "top": 0.4,
    "bottom": 0.8,
    "left": 9.9,
    "right": 5.0
  },
  "dominantAxis": {
    "centroid": {
      "x": 261.2,
      "y": 423.8
    },
    "angleDegFromHorizontal": 106.1,
    "eigenvalueRatio": 1.75,
    "note": "angleDegFromHorizontal is the dominant axis of the alpha-weighted pixel mass (PCA major eigenvector), 0=horizontal, 90=vertical. eigenvalueRatio is major/minor axis spread -- higher means a more elongated (tubing-like), lower means a more compact (chestpiece-like) overall mass."
  },
  "chestpieceCandidate": {
    "center": {
      "x": 201.1,
      "y": 581.1
    },
    "estimatedRadiusPx": 105.7,
    "circularity": 1.0,
    "note": "Heuristic candidate from the opaque mask's distance-transform peak (thickest point of the silhouette), not a verified anatomical detection. circularity is the fraction of a same-radius circle centered here that falls inside the product mask -- closer to 1.0 supports 'this is a round chestpiece-like region', not proof."
  },
  "openLoopRegions": [],
  "criticalRegions": [
    {
      "role": "chestpiece",
      "reason": "The chestpiece disc is the product's primary recognizable feature -- must not be cropped or covered by text/frame.",
      "approxCenter": {
        "x": 201.1,
        "y": 581.1
      },
      "approxRadiusPx": 105.7
    }
  ],
  "suggestedCrops": {
    "fullProductHero": {
      "x": 0,
      "y": 0,
      "width": 576,
      "height": 756
    },
    "macroChestpieceDetail": {
      "x": 21,
      "y": 397,
      "width": 359,
      "height": 359
    }
  }
}